SQL> 
SQL> 
SQL> 
SQL> rem vamos a crear la tercera tabla del mr1
SQL> rem es la tabla sedes
SQL> 
SQL> CREATE TABLE SEDES (
  2  ID_SEDE NUMBER(6) primary key,
  3  TEL_SEDE VARCHAR2(9),
  4  CALLE VARCHAR2(30),
  5  NUMERO NUMBER(3),
  6  CP NUMBER(5),
  7  TAMANO NUMBER(4),
  8  foreign key (ID_POB) references poblaciones
  9  );
foreign key (ID_POB) references poblaciones
             *
ERROR en línea 8:
ORA-00904: "ID_POB": identificador no válido 


SQL> CREATE TABLE SEDES (
  2  ID_SEDE NUMBER(6) primary key,
  3  TEL_SEDE VARCHAR2(9),
  4  CALLE VARCHAR2(30),
  5  NUMERO NUMBER(3),
  6  CP NUMBER(5),
  7  TAMANO NUMBER(4),
  8  foreign key (ID_POB) references POBLACIONES
  9  );
foreign key (ID_POB) references POBLACIONES
             *
ERROR en línea 8:
ORA-00904: "ID_POB": identificador no válido 


SQL> DESC POBLACIONES
 Nombre                                    ¿Nulo?   Tipo
 ----------------------------------------- -------- ----------------------------
 ID_POB                                    NOT NULL NUMBER(5)
 NOMB_POB                                           VARCHAR2(35)
 HAB_POB                                            NUMBER(7)
 EXT_POB                                            NUMBER(3)
 N_PROVINCIAS                                       VARCHAR2(20)

SQL> CREATE TABLE SEDES (
  2  ID_SEDE NUMBER(6) primary key,
  3  TEL_SEDE VARCHAR2(9),
  4  CALLE VARCHAR2(30),
  5  NUMERO NUMBER(3),
  6  CP NUMBER(5),
  7  TAMANO NUMBER(4),
  8  foreign key (ID_POB) references POBLACIONES
  9  );
foreign key (ID_POB) references POBLACIONES
             *
ERROR en línea 8:
ORA-00904: "ID_POB": identificador no válido 


SQL> DESC PROVINCIAS
 Nombre                                    ¿Nulo?   Tipo
 ----------------------------------------- -------- ----------------------------
 N_PROVINCIA                               NOT NULL VARCHAR2(20)
 EXT_PROV                                           NUMBER(5)
 HAB_PROV                                           NUMBER(7)

SQL> CREATE TABLE SEDES (
  2  ID_SEDE NUMBER(6) primary key,
  3  TEL_SEDE VARCHAR2(9),
  4  CALLE VARCHAR2(30),
  5  NUMERO NUMBER(3),
  6  CP NUMBER(5),
  7  TAMANO NUMBER(4),
  8  ID_POB NUMBER(5),
  9  foreign key (ID_POB) references POBLACIONES
 10  );

Tabla creada.

SQL> rem tenemos la tabla sedes
SQL> 
SQL> INSERT INTO SEDES VALUES (1, '945625321', 'Valencia', 14, 28300, 286, 2);
INSERT INTO SEDES VALUES (1, '945625321', 'Valencia', 14, 28300, 286, 2)
*
ERROR en línea 1:
ORA-02291: restricción de integridad (TMACRI.SYS_C004014) violada - clave 
principal no encontrada 


SQL> INSERT INTO SEDES VALUES (1, '945625321', 'Valencia', 14, 28300, 286, 2);
INSERT INTO SEDES VALUES (1, '945625321', 'Valencia', 14, 28300, 286, 2)
*
ERROR en línea 1:
ORA-02291: restricción de integridad (TMACRI.SYS_C004014) violada - clave 
principal no encontrada 


SQL> select * from poblaciones
  2  ;

ninguna fila seleccionada

SQL> INSERT INTO POBLACIONES VALUES (0001, 'MADRID', 3305408, 604, 'MADRID');

1 fila creada.

SQL> 
SQL> 1 fila creada.
SQL> 
SQL> SQL> INSERT INTO POBLACIONES VALUES (0002, 'ARANJUEZ', 59833, 201, 'MADRID');
SP2-0734: inicio "SQL> INSER..." de comando desconocido - resto de la línea ignorado.
SQL> INSERT INTO POBLACIONES VALUES (0002, 'ARANJUEZ', 59833, 201, 'MADRID');

1 fila creada.

SQL> 
SQL> 1 fila creada.
SQL> 
SQL>  INSERT INTO POBLACIONES VALUES (0003, 'CARTAGENA', 213943, 558, 'MURCIA');

1 fila creada.

SQL> 
SQL> 1 fila creada.
SQL> 
SQL>  INSERT INTO POBLACIONES VALUES (0003, 'MURCIA', 447182, 881, 'MURCIA');
 INSERT INTO POBLACIONES VALUES (0003, 'MURCIA', 447182, 881, 'MURCIA')
*
ERROR en línea 1:
ORA-00001: restricción única (TMACRI.SYS_C004011) violada 


SQL> INSERT INTO POBLACIONES VALUES (0003, 'MURCIA', 447182, 881, 'MURCIA')
  2  *
  3  ERROR en l¡nea 1:
  4  ORA-00001: restricci¢n £nica (TMACRI.SYS_C004011) violada
  5  
SQL> 
SQL>  INSERT INTO POBLACIONES VALUES (0004, 'MURCIA', 447182, 881, 'MURCIA');

1 fila creada.

SQL> INSERT INTO POBLACIONES VALUES (5, 'BARCELONA', 1636732, 102, 'BARCELONA');

1 fila creada.

SQL> 
SQL> 1 fila creada.
SQL> 
SQL>  INSERT INTO POBLACIONES VALUES (6, 'CASTELLDEFELS', 66375, 13, 'BARCELONA');

1 fila creada.

SQL> 
SQL> 1 fila creada.
SQL> 
SQL>  select * from poblaciones;

    ID_POB NOMB_POB                               HAB_POB    EXT_POB            
---------- ----------------------------------- ---------- ----------            
N_PROVINCIAS                                                                    
--------------------                                                            
         1 MADRID                                 3305408        604            
MADRID                                                                          
                                                                                
         2 ARANJUEZ                                 59833        201            
MADRID                                                                          
                                                                                
         3 CARTAGENA                               213943        558            
MURCIA                                                                          
                                                                                

    ID_POB NOMB_POB                               HAB_POB    EXT_POB            
---------- ----------------------------------- ---------- ----------            
N_PROVINCIAS                                                                    
--------------------                                                            
         4 MURCIA                                  447182        881            
MURCIA                                                                          
                                                                                
         5 BARCELONA                              1636732        102            
BARCELONA                                                                       
                                                                                
         6 CASTELLDEFELS                            66375         13            
BARCELONA                                                                       
                                                                                

6 filas seleccionadas.

SQL> 
SQL>     ID_POB NOMB_POB                               HAB_POB    EXT_POB N_PROVINCIAS
SP2-0734: inicio "ID_POB NOM..." de comando desconocido - resto de la línea ignorado.
SQL> ---------- ----------------------------------- ---------- ---------- --------------------
SQL>          1 MADRID                                 3305408        604 MADRID
SQL>          2 ARANJUEZ                                 59833        201 MADRID
SQL>          3 CARTAGENA                               213943        558 MURCIA
SQL>          4 MURCIA                                  447182        881 MURCIA
SQL>          5 BARCELONA                              1636732        102 BARCELONA
SQL>          6 CASTELLDEFELS                            66375         13 BARCELONA
SQL> 
SQL> 6 filas seleccionadas.
SQL> 
SQL>  INSERT INTO POBLACIONES VALUES (0007, 'SEVILLA', 688711, 140, 'SEVILLA');

1 fila creada.

SQL> 
SQL> 1 fila creada.
SQL> 
SQL>  INSERT INTO POBLACIONES VALUES (0008, 'UTRERA', 52617, 684, 'SEVILLA');

1 fila creada.

SQL> 
SQL> 1 fila creada.
SQL> 
SQL>  INSERT INTO POBLACIONES VALUES (0010, 'VALLAOLID', 298866, 198, 'VALLADOLID');

1 fila creada.

SQL> 
SQL> 1 fila creada.
SQL> 
SQL>  select * from poblaciones;

    ID_POB NOMB_POB                               HAB_POB    EXT_POB            
---------- ----------------------------------- ---------- ----------            
N_PROVINCIAS                                                                    
--------------------                                                            
         1 MADRID                                 3305408        604            
MADRID                                                                          
                                                                                
         2 ARANJUEZ                                 59833        201            
MADRID                                                                          
                                                                                
         3 CARTAGENA                               213943        558            
MURCIA                                                                          
                                                                                

    ID_POB NOMB_POB                               HAB_POB    EXT_POB            
---------- ----------------------------------- ---------- ----------            
N_PROVINCIAS                                                                    
--------------------                                                            
         4 MURCIA                                  447182        881            
MURCIA                                                                          
                                                                                
         5 BARCELONA                              1636732        102            
BARCELONA                                                                       
                                                                                
         6 CASTELLDEFELS                            66375         13            
BARCELONA                                                                       
                                                                                

    ID_POB NOMB_POB                               HAB_POB    EXT_POB            
---------- ----------------------------------- ---------- ----------            
N_PROVINCIAS                                                                    
--------------------                                                            
         7 SEVILLA                                 688711        140            
SEVILLA                                                                         
                                                                                
         8 UTRERA                                   52617        684            
SEVILLA                                                                         
                                                                                
        10 VALLAOLID                               298866        198            
VALLADOLID                                                                      
                                                                                

9 filas seleccionadas.

SQL> set linesize 300
SQL> set pagesize 300
SQL>  select * from poblaciones;

    ID_POB NOMB_POB                               HAB_POB    EXT_POB N_PROVINCIAS                                                                                                                                                                                                                           
---------- ----------------------------------- ---------- ---------- --------------------                                                                                                                                                                                                                   
         1 MADRID                                 3305408        604 MADRID                                                                                                                                                                                                                                 
         2 ARANJUEZ                                 59833        201 MADRID                                                                                                                                                                                                                                 
         3 CARTAGENA                               213943        558 MURCIA                                                                                                                                                                                                                                 
         4 MURCIA                                  447182        881 MURCIA                                                                                                                                                                                                                                 
         5 BARCELONA                              1636732        102 BARCELONA                                                                                                                                                                                                                              
         6 CASTELLDEFELS                            66375         13 BARCELONA                                                                                                                                                                                                                              
         7 SEVILLA                                 688711        140 SEVILLA                                                                                                                                                                                                                                
         8 UTRERA                                   52617        684 SEVILLA                                                                                                                                                                                                                                
        10 VALLAOLID                               298866        198 VALLADOLID                                                                                                                                                                                                                             

9 filas seleccionadas.

SQL> rem borrar casi todo
SQL> rem borrar casi todo
SQL> rem borrar casi todo
SQL> rem borrar casi todo
SQL> rem borrar casi todo
SQL>  select * from poblaciones;

    ID_POB NOMB_POB                               HAB_POB    EXT_POB N_PROVINCIAS                                                                                                                                                                                                                           
---------- ----------------------------------- ---------- ---------- --------------------                                                                                                                                                                                                                   
         1 MADRID                                 3305408        604 MADRID                                                                                                                                                                                                                                 
         2 ARANJUEZ                                 59833        201 MADRID                                                                                                                                                                                                                                 
         3 CARTAGENA                               213943        558 MURCIA                                                                                                                                                                                                                                 
         4 MURCIA                                  447182        881 MURCIA                                                                                                                                                                                                                                 
         5 BARCELONA                              1636732        102 BARCELONA                                                                                                                                                                                                                              
         6 CASTELLDEFELS                            66375         13 BARCELONA                                                                                                                                                                                                                              
         7 SEVILLA                                 688711        140 SEVILLA                                                                                                                                                                                                                                
         8 UTRERA                                   52617        684 SEVILLA                                                                                                                                                                                                                                
        10 VALLAOLID                               298866        198 VALLADOLID                                                                                                                                                                                                                             

9 filas seleccionadas.

SQL>  select * from poblaciones;

    ID_POB NOMB_POB                               HAB_POB    EXT_POB N_PROVINCIAS                                                                                                                                                                                                                           
---------- ----------------------------------- ---------- ---------- --------------------                                                                                                                                                                                                                   
         1 MADRID                                 3305408        604 MADRID                                                                                                                                                                                                                                 
         2 ARANJUEZ                                 59833        201 MADRID                                                                                                                                                                                                                                 
         3 CARTAGENA                               213943        558 MURCIA                                                                                                                                                                                                                                 
         4 MURCIA                                  447182        881 MURCIA                                                                                                                                                                                                                                 
         5 BARCELONA                              1636732        102 BARCELONA                                                                                                                                                                                                                              
         6 CASTELLDEFELS                            66375         13 BARCELONA                                                                                                                                                                                                                              
         7 SEVILLA                                 688711        140 SEVILLA                                                                                                                                                                                                                                
         8 UTRERA                                   52617        684 SEVILLA                                                                                                                                                                                                                                
        10 VALLAOLID                               298866        198 VALLADOLID                                                                                                                                                                                                                             

9 filas seleccionadas.

SQL> set pagesize 300
SQL> INSERT INTO SEDES VALUES (1, '945625321', 'Valencia', 14, 28300, 286, 2);

1 fila creada.

SQL> INSERT INTO SEDES VALUES (2, '945325984', 'Alcala', 227, 28028, 156, 1);
	
1 fila creada.

SQL> INSERT INTO SEDES VALUES (2, '9454865', 'la Concha', 8, 28300, 86, 2);
INSERT INTO SEDES VALUES (2, '9454865', 'la Concha', 8, 28300, 86, 2)
*
ERROR en línea 1:
ORA-00001: restricción única (TMACRI.SYS_C004013) violada 


SQL> INSERT INTO SEDES VALUES (3, '9454865', 'la Concha', 8, 28300, 86, 2);

1 fila creada.

SQL> INSERT INTO SEDES VALUES (4, '975643222', 'Valencia', 466, 08013, 166, 5);

1 fila creada.

SQL> update SEDES SET TEL_SEDE='945486533' WHERE ID_SEDE = 3;

1 fila actualizada.

SQL>  select * from SEDES;

   ID_SEDE TEL_SEDE  CALLE                              NUMERO         CP     TAMANO     ID_POB                                                                                                                                                                                                             
---------- --------- ------------------------------ ---------- ---------- ---------- ----------                                                                                                                                                                                                             
         1 945625321 Valencia                               14      28300        286          2                                                                                                                                                                                                             
         2 945325984 Alcala                                227      28028        156          1                                                                                                                                                                                                             
         3 945486533 la Concha                               8      28300         86          2                                                                                                                                                                                                             
         4 975643222 Valencia                              466       8013        166          5                                                                                                                                                                                                             

SQL> INSERT INTO SEDES VALUES (5, '975612489', 'Ardilla', 5, 41010, 202, 7);

1 fila creada.

SQL>  select * from SEDES;

   ID_SEDE TEL_SEDE  CALLE                              NUMERO         CP     TAMANO     ID_POB                                                                                                                                                                                                             
---------- --------- ------------------------------ ---------- ---------- ---------- ----------                                                                                                                                                                                                             
         1 945625321 Valencia                               14      28300        286          2                                                                                                                                                                                                             
         2 945325984 Alcala                                227      28028        156          1                                                                                                                                                                                                             
         3 945486533 la Concha                               8      28300         86          2                                                                                                                                                                                                             
         4 975643222 Valencia                              466       8013        166          5                                                                                                                                                                                                             
         5 975612489 Ardilla                                 5      41010        202          7                                                                                                                                                                                                             

SQL> rem algunas sedes cargadas
SQL> rem algunas sedes cargadas
SQL> rem algunas sedes cargadas
SQL> rem algunas sedes cargadas
SQL> rem algunas sedes cargadas
SQL> rem algunas sedes cargadas
SQL> rem algunas sedes cargadas
SQL> rem algunas sedes cargadas
SQL> rem algunas sedes cargadas
SQL> rem algunas sedes cargadas
SQL> rem algunas sedes cargadas
SQL> rem algunas sedes cargadas
SQL> rem algunas sedes cargadas
SQL> 
SQL> rem algunas sedes cargadas
SQL> 
SQL> 
SQL> 
SQL> 
SQL> 
SQL> rem TABLA PROOVEDORES
SQL> rem TABLA PROOVEDORES
SQL> rem TABLA PROOVEDORES
SQL> rem TABLA PROOVEDORES
SQL> rem TABLA PROOVEDORES
SQL> rem TABLA PROOVEDORES
SQL> rem TABLA PROOVEDORES
SQL> rem TABLA PROVEEDORES
SQL> rem TABLA PROVEEDORES
SQL> rem TABLA PROVEEDORES
SQL> rem TABLA PROVEEDORES
SQL> rem TABLA PROVEEDORES
SQL> rem TABLA PROVEEDORES
SQL> rem TABLA PROVEEDORES
SQL> 
SQL> 
SQL> CREATE TABLE PROVEEDORES (
  2  ID_PROV NUMBER(4) primary key,
  3  N_PROV VARCHAR2(30),
  4  TEL_PROV VARCHAR2(9),
  5  CALLE NUMBER(30),
  6  NUMERO NUMBER(3),
  7  CP NUMBER(5),
  8  N_PROVINCIA VARCHAR2(20),
  9  foreign key (N_PROVINCIA) references provincias
 10  );

Tabla creada.

SQL> INSERT INTO SEDES VALUES (1,'Mancuernas Gonzalez', '9122018012', 'San Norberto', 4, 28021, 'MADRID');
INSERT INTO SEDES VALUES (1,'Mancuernas Gonzalez', '9122018012', 'San Norberto', 4, 28021, 'MADRID')
                            *
ERROR en línea 1:
ORA-12899: el valor es demasiado grande para la columna "TMACRI"."SEDES"."TEL_SEDE" (real: 19, máximo: 9) 


SQL> INSERT INTO SEDES VALUES (1,'Mancuernas Gonzalez', '912201812', 'San Norberto', 4, 28021, 'MADRID');
INSERT INTO SEDES VALUES (1,'Mancuernas Gonzalez', '912201812', 'San Norberto', 4, 28021, 'MADRID')
                            *
ERROR en línea 1:
ORA-12899: el valor es demasiado grande para la columna "TMACRI"."SEDES"."TEL_SEDE" (real: 19, máximo: 9) 


SQL> INSERT INTO PROVEEDORES VALUES (1,'Mancuernas Gonzalez', '912201812', 'San Norberto', 4, 28021, 'MADRID');
INSERT INTO PROVEEDORES VALUES (1,'Mancuernas Gonzalez', '912201812', 'San Norberto', 4, 28021, 'MADRID')
                                                                      *
ERROR en línea 1:
ORA-01722: número no válido 


SQL> DROP TABLE PROVEEDORES;

Tabla borrada.

SQL> CREATE TABLE PROVEEDORES (
  2  ID_PROV NUMBER(4) primary key,
  3  N_PROV VARCHAR2(30),
  4  TEL_PROV VARCHAR2(9),
  5  CALLE VARCHAR2(30),
  6  NUMERO NUMBER(3),
  7  CP NUMBER(5),
  8  N_PROVINCIA VARCHAR2(20),
  9  foreign key (N_PROVINCIA) references provincias
 10  );

Tabla creada.

SQL> INSERT INTO PROVEEDORES VALUES (1,'Mancuernas Gonzalez', '912201812', 'San Norberto', 4, 28021, 'MADRID');

1 fila creada.

SQL> INSERT INTO PROVEEDORES VALUES (2,'Maquinas Pepe', '915346684', 'Callejon de la Galinda', 10, 41810, 'SEVILLA');

1 fila creada.

SQL> INSERT INTO PROVEEDORES VALUES (3,'Camisetas Sanchez', '943892754', 'San Pedro', 3, 30610, 'MURCIA');

1 fila creada.

SQL> INSERT INTO PROVEEDORES VALUES (4,'Bicicletas Gomez', '935684698', 'Carrer Industria', 1, 08279, 'BARCELONA');

1 fila creada.

SQL> INSERT INTO PROVEEDORES VALUES (5,'Botellas Rajoy', '965251235', 'Catedral', 3, 47002, 'VALLADOLID');

1 fila creada.

SQL> rem fin tabla proveedores
SQL> rem fin tabla proveedores
SQL> rem fin tabla proveedores
SQL> rem fin tabla proveedores
SQL> rem fin tabla proveedores
SQL> rem fin tabla proveedores
SQL> rem fin tabla proveedores
SQL> rem fin tabla proveedores
SQL> rem fin tabla proveedores
SQL> rem fin tabla proveedores
SQL> rem fin tabla proveedores
SQL> 
SQL> rem cierro spool
SQL> spool off
